{
  "schema_version": "7.0",
  "artifact_type": "kristall_axis_registry",
  "namespace_id": "kristall-main",
  "registry_id": "reg:axes",
  "axes": [
    {
      "axis_id": "KQ2001",
      "axis_type": "orientation",
      "label": "Legal authority",
      "description": "Legal power orientation",
      "status": "active",
      "semantics": {
        "intent": "Prefer legal authority, jurisdiction and review."
      },
      "provenance": {
        "mode": "authored"
      },
      "axis_type_id": "KQ3009"
    },
    {
      "axis_id": "KQ2002",
      "axis_type": "orientation",
      "label": "Informal influence",
      "description": "Informal influence orientation",
      "status": "active",
      "semantics": {
        "intent": "Prefer attention, dependency, persuasion and networks."
      },
      "provenance": {
        "mode": "hybrid"
      },
      "axis_type_id": "KQ3010"
    }
  ]
}
